{
  "schema_version": "2.9.0",
  "published_at": "2026-07-15T18:26:10Z",
  "authoritative_until": "2026-07-15T18:00:00Z",
  "update_seconds": 300,
  "min_level": 2,
  "sources": [
    {
      "source": "glm-east",
      "observed_until": "2026-07-15T18:25:40Z"
    },
    {
      "source": "glm-west",
      "observed_until": "2026-07-15T18:25:40Z"
    },
    {
      "source": "mtg-li",
      "observed_until": "2026-07-15T18:20:00Z"
    }
  ],
  "cells": [
    {
      "id": "synthetic-tampa",
      "provisional": false,
      "previous_ids": [],
      "slug": "2026-07-15-tampa",
      "name": "Tampa",
      "level": 4,
      "flashes": 2104,
      "t_start": "2026-07-15T16:58:41Z",
      "t_end": "2026-07-15T18:25:31Z",
      "lat": 27.95,
      "lon": -82.39,
      "bounds": {
        "west": -82.614,
        "south": 27.762,
        "east": -82.166,
        "north": 28.138
      },
      "area_km2": 1520.0,
      "hull": [
        [
          -82.166,
          27.95
        ],
        [
          -82.209,
          28.066
        ],
        [
          -82.321,
          28.138
        ],
        [
          -82.459,
          28.138
        ],
        [
          -82.571,
          28.066
        ],
        [
          -82.614,
          27.95
        ],
        [
          -82.571,
          27.834
        ],
        [
          -82.459,
          27.762
        ],
        [
          -82.321,
          27.762
        ],
        [
          -82.209,
          27.834
        ],
        [
          -82.166,
          27.95
        ]
      ],
      "sources": [
        "glm-east"
      ],
      "split_from": null,
      "merged": [],
      "path": [
        {
          "time": "2026-07-15T17:05:12Z",
          "lat": 27.71,
          "lon": -82.95,
          "flash_count": 140
        },
        {
          "time": "2026-07-15T17:14:40Z",
          "lat": 27.74,
          "lon": -82.88,
          "flash_count": 212
        },
        {
          "time": "2026-07-15T17:25:03Z",
          "lat": 27.77,
          "lon": -82.81,
          "flash_count": 260
        },
        {
          "time": "2026-07-15T17:34:51Z",
          "lat": 27.8,
          "lon": -82.74,
          "flash_count": 301
        },
        {
          "time": "2026-07-15T17:44:58Z",
          "lat": 27.83,
          "lon": -82.67,
          "flash_count": 344
        },
        {
          "time": "2026-07-15T17:55:10Z",
          "lat": 27.86,
          "lon": -82.6,
          "flash_count": 330
        },
        {
          "time": "2026-07-15T18:04:47Z",
          "lat": 27.89,
          "lon": -82.53,
          "flash_count": 352
        },
        {
          "time": "2026-07-15T18:15:02Z",
          "lat": 27.92,
          "lon": -82.46,
          "flash_count": 371
        },
        {
          "time": "2026-07-15T18:24:20Z",
          "lat": 27.95,
          "lon": -82.39,
          "flash_count": 268
        }
      ]
    },
    {
      "id": "synthetic-lakeland",
      "provisional": false,
      "previous_ids": [],
      "slug": "2026-07-15-lakeland",
      "name": "Lakeland",
      "level": 3,
      "flashes": 388,
      "t_start": "2026-07-15T17:41:09Z",
      "t_end": "2026-07-15T18:24:58Z",
      "lat": 28.04,
      "lon": -82.09,
      "bounds": {
        "west": -82.209,
        "south": 27.94,
        "east": -81.971,
        "north": 28.14
      },
      "area_km2": 430.0,
      "hull": [
        [
          -81.971,
          28.04
        ],
        [
          -81.994,
          28.102
        ],
        [
          -82.053,
          28.14
        ],
        [
          -82.127,
          28.14
        ],
        [
          -82.186,
          28.102
        ],
        [
          -82.209,
          28.04
        ],
        [
          -82.186,
          27.978
        ],
        [
          -82.127,
          27.94
        ],
        [
          -82.053,
          27.94
        ],
        [
          -81.994,
          27.978
        ],
        [
          -81.971,
          28.04
        ]
      ],
      "sources": [
        "glm-east"
      ],
      "split_from": null,
      "merged": [],
      "path": [
        {
          "time": "2026-07-15T17:46:00Z",
          "lat": 28.02,
          "lon": -81.98,
          "flash_count": 60
        },
        {
          "time": "2026-07-15T17:55:30Z",
          "lat": 28.03,
          "lon": -82.0,
          "flash_count": 95
        },
        {
          "time": "2026-07-15T18:05:10Z",
          "lat": 28.03,
          "lon": -82.03,
          "flash_count": 120
        },
        {
          "time": "2026-07-15T18:14:45Z",
          "lat": 28.04,
          "lon": -82.06,
          "flash_count": 133
        },
        {
          "time": "2026-07-15T18:23:58Z",
          "lat": 28.04,
          "lon": -82.09,
          "flash_count": 88
        }
      ]
    },
    {
      "id": "synthetic-lagos",
      "provisional": false,
      "previous_ids": [],
      "slug": "2026-07-15-lagos",
      "name": "Lagos",
      "level": 3,
      "flashes": 301,
      "t_start": "2026-07-15T17:38:02Z",
      "t_end": "2026-07-15T18:19:47Z",
      "lat": 6.37,
      "lon": 3.36,
      "bounds": {
        "west": 3.234,
        "south": 6.251,
        "east": 3.486,
        "north": 6.489
      },
      "area_km2": 610.0,
      "hull": [
        [
          3.486,
          6.37
        ],
        [
          3.462,
          6.444
        ],
        [
          3.399,
          6.489
        ],
        [
          3.321,
          6.489
        ],
        [
          3.258,
          6.444
        ],
        [
          3.234,
          6.37
        ],
        [
          3.258,
          6.296
        ],
        [
          3.321,
          6.251
        ],
        [
          3.399,
          6.251
        ],
        [
          3.462,
          6.296
        ],
        [
          3.486,
          6.37
        ]
      ],
      "sources": [
        "mtg-li"
      ],
      "split_from": null,
      "merged": [],
      "path": [
        {
          "time": "2026-07-15T17:45:20Z",
          "lat": 6.31,
          "lon": 3.21,
          "flash_count": 55
        },
        {
          "time": "2026-07-15T17:54:50Z",
          "lat": 6.33,
          "lon": 3.26,
          "flash_count": 71
        },
        {
          "time": "2026-07-15T18:05:05Z",
          "lat": 6.35,
          "lon": 3.31,
          "flash_count": 84
        },
        {
          "time": "2026-07-15T18:14:40Z",
          "lat": 6.37,
          "lon": 3.36,
          "flash_count": 62
        }
      ]
    },
    {
      "id": "synthetic-gulf-1808",
      "provisional": true,
      "previous_ids": [],
      "slug": null,
      "name": null,
      "level": 2,
      "flashes": 47,
      "t_start": "2026-07-15T18:08:13Z",
      "t_end": "2026-07-15T18:25:12Z",
      "lat": 26.43,
      "lon": -84.66,
      "bounds": {
        "west": -84.729,
        "south": 26.371,
        "east": -84.591,
        "north": 26.489
      },
      "area_km2": 150.0,
      "hull": [
        [
          -84.591,
          26.43
        ],
        [
          -84.604,
          26.467
        ],
        [
          -84.639,
          26.489
        ],
        [
          -84.681,
          26.489
        ],
        [
          -84.716,
          26.467
        ],
        [
          -84.729,
          26.43
        ],
        [
          -84.716,
          26.393
        ],
        [
          -84.681,
          26.371
        ],
        [
          -84.639,
          26.371
        ],
        [
          -84.604,
          26.393
        ],
        [
          -84.591,
          26.43
        ]
      ],
      "sources": [
        "glm-east"
      ],
      "split_from": null,
      "merged": [],
      "path": [
        {
          "time": "2026-07-15T18:12:30Z",
          "lat": 26.41,
          "lon": -84.72,
          "flash_count": 18
        },
        {
          "time": "2026-07-15T18:21:04Z",
          "lat": 26.43,
          "lon": -84.66,
          "flash_count": 29
        }
      ]
    },
    {
      "id": "synthetic-bangui-1812",
      "provisional": true,
      "previous_ids": [],
      "slug": null,
      "name": null,
      "level": 2,
      "flashes": 24,
      "t_start": "2026-07-15T18:12:04Z",
      "t_end": "2026-07-15T18:19:30Z",
      "lat": 4.41,
      "lon": 18.52,
      "bounds": {
        "west": 18.47,
        "south": 4.363,
        "east": 18.57,
        "north": 4.457
      },
      "area_km2": 95.0,
      "hull": [
        [
          18.57,
          4.41
        ],
        [
          18.56,
          4.439
        ],
        [
          18.535,
          4.457
        ],
        [
          18.505,
          4.457
        ],
        [
          18.48,
          4.439
        ],
        [
          18.47,
          4.41
        ],
        [
          18.48,
          4.381
        ],
        [
          18.505,
          4.363
        ],
        [
          18.535,
          4.363
        ],
        [
          18.56,
          4.381
        ],
        [
          18.57,
          4.41
        ]
      ],
      "sources": [
        "mtg-li"
      ],
      "split_from": null,
      "merged": [],
      "path": [
        {
          "time": "2026-07-15T18:15:30Z",
          "lat": 4.41,
          "lon": 18.52,
          "flash_count": 24
        }
      ]
    }
  ],
  "ended": [
    {
      "id": "synthetic-key-west",
      "reason": "expired",
      "into": null,
      "t_end": "2026-07-15T17:39:20Z",
      "ended_at": "2026-07-15T18:11:05Z"
    }
  ]
}
