{
  "schema_version": "2.8.0",
  "published_at": "2026-07-15T19:41:50Z",
  "authoritative_until": "2026-07-15T19:00:00Z",
  "update_seconds": 300,
  "min_level": 2,
  "sources": [
    {
      "source": "glm-east",
      "observed_until": "2026-07-15T19:41:40Z"
    },
    {
      "source": "glm-west",
      "observed_until": "2026-07-15T19:41:40Z"
    },
    {
      "source": "mtg-li",
      "observed_until": "2026-07-15T18:30:00Z"
    }
  ],
  "cells": [
    {
      "id": "synthetic-tampa",
      "provisional": false,
      "previous_ids": [],
      "slug": "2026-07-15-tampa",
      "name": "Tampa",
      "level": 5,
      "flashes": 4588,
      "t_start": "2026-07-15T16:58:41Z",
      "t_end": "2026-07-15T19:41:12Z",
      "lat": 28.16,
      "lon": -81.89,
      "bounds": {
        "west": -82.093,
        "south": 27.99,
        "east": -81.687,
        "north": 28.33
      },
      "area_km2": 1240.0,
      "hull": [
        [
          -81.687,
          28.16
        ],
        [
          -81.726,
          28.265
        ],
        [
          -81.827,
          28.33
        ],
        [
          -81.953,
          28.33
        ],
        [
          -82.054,
          28.265
        ],
        [
          -82.093,
          28.16
        ],
        [
          -82.054,
          28.055
        ],
        [
          -81.953,
          27.99
        ],
        [
          -81.827,
          27.99
        ],
        [
          -81.726,
          28.055
        ],
        [
          -81.687,
          28.16
        ]
      ],
      "sources": [
        "glm-east"
      ],
      "split_from": null,
      "merged": [],
      "path": [
        {
          "time": "2026-07-15T17:44:58Z",
          "lat": 27.83,
          "lon": -82.67,
          "flash_count": 344
        },
        {
          "time": "2026-07-15T17:55:10Z",
          "lat": 27.86,
          "lon": -82.6,
          "flash_count": 330
        },
        {
          "time": "2026-07-15T18:04:47Z",
          "lat": 27.89,
          "lon": -82.53,
          "flash_count": 352
        },
        {
          "time": "2026-07-15T18:15:02Z",
          "lat": 27.92,
          "lon": -82.46,
          "flash_count": 371
        },
        {
          "time": "2026-07-15T18:24:55Z",
          "lat": 27.95,
          "lon": -82.39,
          "flash_count": 395
        },
        {
          "time": "2026-07-15T18:34:40Z",
          "lat": 27.98,
          "lon": -82.32,
          "flash_count": 330
        },
        {
          "time": "2026-07-15T18:44:31Z",
          "lat": 28.01,
          "lon": -82.24,
          "flash_count": 462
        },
        {
          "time": "2026-07-15T18:54:50Z",
          "lat": 28.04,
          "lon": -82.17,
          "flash_count": 418
        },
        {
          "time": "2026-07-15T19:04:36Z",
          "lat": 28.07,
          "lon": -82.1,
          "flash_count": 380
        },
        {
          "time": "2026-07-15T19:14:22Z",
          "lat": 28.1,
          "lon": -82.03,
          "flash_count": 352
        },
        {
          "time": "2026-07-15T19:24:41Z",
          "lat": 28.13,
          "lon": -81.96,
          "flash_count": 310
        },
        {
          "time": "2026-07-15T19:34:28Z",
          "lat": 28.16,
          "lon": -81.89,
          "flash_count": 255
        }
      ]
    },
    {
      "id": "synthetic-tampa-split",
      "provisional": false,
      "previous_ids": [],
      "slug": "2026-07-15-tampa-2",
      "name": "Tampa",
      "level": 3,
      "flashes": 369,
      "t_start": "2026-07-15T18:31:08Z",
      "t_end": "2026-07-15T19:40:51Z",
      "lat": 27.78,
      "lon": -81.87,
      "bounds": {
        "west": -81.945,
        "south": 27.717,
        "east": -81.795,
        "north": 27.843
      },
      "area_km2": 170.0,
      "hull": [
        [
          -81.795,
          27.78
        ],
        [
          -81.81,
          27.819
        ],
        [
          -81.847,
          27.843
        ],
        [
          -81.893,
          27.843
        ],
        [
          -81.93,
          27.819
        ],
        [
          -81.945,
          27.78
        ],
        [
          -81.93,
          27.741
        ],
        [
          -81.893,
          27.717
        ],
        [
          -81.847,
          27.717
        ],
        [
          -81.81,
          27.741
        ],
        [
          -81.795,
          27.78
        ]
      ],
      "sources": [
        "glm-east"
      ],
      "split_from": "synthetic-tampa",
      "merged": [],
      "path": [
        {
          "time": "2026-07-15T18:35:20Z",
          "lat": 27.9,
          "lon": -82.29,
          "flash_count": 31
        },
        {
          "time": "2026-07-15T18:44:12Z",
          "lat": 27.88,
          "lon": -82.22,
          "flash_count": 47
        },
        {
          "time": "2026-07-15T18:54:35Z",
          "lat": 27.86,
          "lon": -82.15,
          "flash_count": 66
        },
        {
          "time": "2026-07-15T19:04:50Z",
          "lat": 27.84,
          "lon": -82.08,
          "flash_count": 71
        },
        {
          "time": "2026-07-15T19:14:30Z",
          "lat": 27.82,
          "lon": -82.01,
          "flash_count": 58
        },
        {
          "time": "2026-07-15T19:24:18Z",
          "lat": 27.8,
          "lon": -81.94,
          "flash_count": 40
        },
        {
          "time": "2026-07-15T19:33:57Z",
          "lat": 27.78,
          "lon": -81.87,
          "flash_count": 28
        }
      ]
    }
  ],
  "ended": [
    {
      "id": "synthetic-lagos",
      "reason": "source-gap",
      "into": null,
      "t_end": "2026-07-15T18:29:40Z",
      "ended_at": "2026-07-15T19:41:50Z"
    },
    {
      "id": "synthetic-bangui-1803",
      "reason": "source-gap",
      "into": null,
      "t_end": "2026-07-15T18:29:51Z",
      "ended_at": "2026-07-15T19:41:50Z"
    },
    {
      "id": "synthetic-gulf-1808",
      "reason": "expired",
      "into": null,
      "t_end": "2026-07-15T18:41:02Z",
      "ended_at": "2026-07-15T19:22:40Z"
    },
    {
      "id": "synthetic-lakeland",
      "reason": "merged",
      "into": "synthetic-tampa",
      "t_end": "2026-07-15T18:44:10Z",
      "ended_at": "2026-07-15T18:46:30Z"
    },
    {
      "id": "synthetic-bangui-1812",
      "reason": "replaced",
      "into": "synthetic-bangui-1803",
      "t_end": "2026-07-15T18:19:30Z",
      "ended_at": "2026-07-15T18:36:20Z"
    },
    {
      "id": "synthetic-key-west",
      "reason": "expired",
      "into": null,
      "t_end": "2026-07-15T17:39:20Z",
      "ended_at": "2026-07-15T18:11:05Z"
    }
  ]
}
